{
  "event_id": "evt_000001",
  "vehicle_id": "EV001",
  "driver_id": "DRV014",
  "timestamp": "2026-08-29T07:30:00Z",
  "latitude": 12.9716,
  "longitude": 77.5946,
  "speed_kmh": 42.5,
  "odometer_km": 18342.7,
  "battery_soc_pct": 78.4,
  "battery_voltage_v": 398.2,
  "battery_current_a": 72.5,
  "battery_temperature_c": 31.8,
  "motor_temperature_c": 54.2,
  "motor_rpm": 3250,
  "brake_temperature_c": 42.1,
  "harsh_acceleration": false,
  "harsh_braking": false,
  "speeding": false,
  "idle_duration_sec": 0,
  "order_id": "ORD100245",
  "route_id": "RT50021",
  "delivery_status": "IN_TRANSIT"
}
